District_Name,UnitName,FIRNo,RI,Year,Month,Offence_From_Date,Offence_To_Date,FIR_Reg_DateTime,FIR_Date,FIR Type,FIR_Stage,Complaint_Mode,CrimeGroup_Name,CrimeHead_Name,Latitude,Longitude,ActSection,IOName,KGID,IOAssigned_Date,Internal_IO,Place of Offence,Distance from PS,Beat_Name,Village_Area_Name,Male,Female,Boy,Girl,Age 0,VICTIM COUNT,Accused Count,Arrested Male,Arrested Female,Arrested Count	No.,Accused_ChargeSheeted Count,Conviction Count,FIR_ID,Unit_ID,Crime_No,Cluster_Labels
Hassan,Channarayapatna Rural PS,0045/2024,1,2024,2,2024-02-16 04:00:00.000,2024-02-19 15:00:00.000,2024-02-19 15:00:00.000,19/02/2024,Non Heinous,Under Investigation,Written,POCSO,Rape,12.912309,76.382054,"IPC 1860 U/s: 363,376 PROTECTION OF CHILDREN FROM SEXUAL OFFENCES ACT 2012 U/s: 4,6,8,12 ",DIVAKARA.R   (PI),1966704,,68200207,"Channarapura Village Dandiganahally Ho, Channarapura Village Dandiganahally Ho",6 kms Towards North,BEAT 8,ANEKERE,0,0,0,1,0,0,0,0,0,0,0,0,2024000054,1621,10455162120240045,-1
Hassan,Hassan Women PS,0042/2020,1,2020,3,2020-03-01 17:30:00.000,2020-03-06 10:00:00.000,2020-03-06 13:00:00.000,06/03/2020,Non Heinous,Dis/Acq,Written,POCSO,Rape,13.013239,76.112037,"IPC 1860 U/s: 376,363 PROTECTION OF CHILDREN FROM SEXUAL OFFENCES ACT 2012 U/s: 6 ",REKHA BAI M H   (PI),1873657,,104500022,"BEERANAHALLY KERE RAGAVENDRA COLONY, BEERANAHALLY KERE RAGAVENDRA COLONY",1 KM TOWARDS NORTH,extension ps,Devamma Badavane,0,0,0,1,0,0,1,1,0,1,1,0,2020000042,2127,10455212720200042,-1
Hassan,Arehalli PS,0085/2023,1,2023,9,2023-09-13 15:00:00.000,2023-09-13 15:10:00.000,2023-09-23 11:30:00.000,23/09/2023,Heinous,Pending Trial,Written,POCSO,Rape,13.004235,75.899084,"PROTECTION OF CHILDREN FROM SEXUAL OFFENCES ACT 2012 U/s: 6 IPC 1860 U/s: 376(2)(J),376(2)(n) ",JAYARAM S N   (PI),2008835,,49000005,"SARVE NO 21/1 SINGARAVALLI VILLAGE, SARVE NO 21/1 SINGARAVALLI VILLAGE",18 km Towards EAST SIDE,2022 NEW BEAT 08,Bikkodu,0,0,0,1,0,0,1,1,0,1,1,0,2023000118,753,10455075320230085,-1
Hassan,Konanur PS,0044/2024,1,2024,2,2023-06-22 06:00:00.000,2023-06-22 06:30:00.000,2024-02-22 09:00:00.000,22/02/2024,Heinous,Transfered :UI( Arakalagud  Circle),Others,POCSO,Rape,12.235648,76.052359,"IPC 1860 U/s: 363,376(2)(n) PROTECTION OF CHILDREN FROM SEXUAL OFFENCES ACT 2012 U/s: 4,6,8,12 Prohibition of Child Marriage Act 2006 U/s: 9,10 ",GOVINDARAJU M V   (PI),2000031,,112900062,"RAMANATHAPURA BUS STAND, RAMANATHAPURA BUS STAND",4 KM TOWARDS  EAST,New village beat 14,RAMANATHAPURA,0,0,0,1,0,0,1,0,0,0,0,0,2024000079,748,10455074820240044,-1
Hassan,Channarayapatna Rural PS,0035/2021,1,2021,3,2021-03-08 00:00:00.000,2021-03-08 00:01:00.000,2021-03-08 20:15:00.000,08/03/2021,Heinous,Pending Trial,Oral,POCSO,Rape,12.956851,76.316574,"IPC 1860 U/s: 376,506 PROTECTION OF CHILDREN FROM SEXUAL OFFENCES ACT 2012 U/s: 4,6,14 ",SANTHOSHA S   (PI),119999,,141200019,"Annenahally Village, Annenahally Village",Towards West and 17 KMS,NEW BEAT NO 19,ANNENAHALLI VILLAGE,0,0,0,1,0,0,1,1,0,1,1,0,2021000038,1621,10455162120210035,-1
Hassan,Goruru PS,0059/2022,1,2022,4,2022-04-20 09:00:00.000,2022-04-22 16:15:00.000,2022-04-22 16:15:00.000,22/04/2022,Heinous,Pending Trial,Written,POCSO,Rape,12.899168,76.027329,"PROTECTION OF CHILDREN FROM SEXUAL OFFENCES ACT 2012 U/s: 6 IPC 1860 U/s: 376,366(A) ",RAVI C V   (PI),1842914.0,,151500001,"COMPALIANT HOUSE, COMPALIANT HOUSE",20 KM TOWARDS EAST,BEAT 11,Kallahalli,0,0,0,1,0,0,0,1,0,1,1,0,2022000065,725,10455072520220059,-1
Hassan,Holenarasipura Rural PS,0152/2023,1,2023,12,2023-12-09 08:00:00.000,2023-12-09 08:10:00.000,2023-12-25 15:40:00.000,25/12/2023,Heinous,Pending Trial,Others,POCSO,Rape,12.781336,76.24764,"IPC 1860 U/s: 363,376 PROTECTION OF CHILDREN FROM SEXUAL OFFENCES ACT 2012 U/s: 6,8,4,12 ",SURESH KUMAR S D   (PI),1432617.0,,59100006,"Mundanahalli Village Kasaba hobli, Mundanahalli Village Kasaba hobli",06 KM Towards West,New Beat NO 13,Billenahally,0,0,0,1,0,0,1,1,0,1,1,0,2023000214,744,10455074420230152,-1
