District_Name,UnitName,FIRNo,RI,Year,Month,Offence_From_Date,Offence_To_Date,FIR_Reg_DateTime,FIR_Date,FIR Type,FIR_Stage,Complaint_Mode,CrimeGroup_Name,CrimeHead_Name,Latitude,Longitude,ActSection,IOName,KGID,IOAssigned_Date,Internal_IO,Place of Offence,Distance from PS,Beat_Name,Village_Area_Name,Male,Female,Boy,Girl,Age 0,VICTIM COUNT,Accused Count,Arrested Male,Arrested Female,Arrested Count	No.,Accused_ChargeSheeted Count,Conviction Count,FIR_ID,Unit_ID,Crime_No,Cluster_Labels
Hubballi Dharwad City,Old Hubballi PS,0125/2020,1,2020,11,2020-11-04 14:35:00.000,2020-11-04 14:50:00.000,2020-11-04 20:00:00.000,04/11/2020,Non Heinous,Pending Trial,Written,THEFT,Cash,15.340674,75.129057,IPC 1860 U/s: 379 ,SUKHANAND  SINGE (PSI),2540702,,7800188,"OLD HUBBALLI, ARAVIND NAGAR, OPPOSITE VIVEKANAND, OLD HUBBALLI, ARAVIND NAGAR, OPPOSITE VIVEKANAND",1 K.M NORTH FROM P.S,BEAT1,SIDDALINGESHWAR COLONY,1,0,0,0,0,0,0,2,0,2,2,0,2020000201,78,10971007820200125,-1
Hubballi Dharwad City,Vidyagiri PS,0024/2021,1,2021,2,2021-02-22 06:55:00.000,2021-02-22 07:15:00.000,2021-02-22 10:30:00.000,22/02/2021,Non Heinous,Undetected,Written,THEFT,Cash,15.417713,75.044237,IPC 1860 U/s: 380 ,S R TEGUR   (PSI),634139,,168700001,"Plot no 78, 2 nd main, Shakti nagar Dharwad, Plot no 78, 2 nd main, Shakti nagar Dharwad",1 KM East From PS,Beat5,Gandi Nagar,1,0,0,0,0,0,0,0,0,0,0,0,2021000030,1687,10971168720210024,-1
Hubballi Dharwad City,Vidyagiri PS,0070/2022,1,2022,4,2022-04-14 19:00:00.000,2022-04-15 09:30:00.000,2022-04-19 10:45:00.000,19/04/2022,Non Heinous,Undetected,Oral,THEFT,Cash,15.432809,75.012976,IPC 1860 U/s: 380 ,Pramod  H G (PSI),2976471,,168700136,"Office Of Ravi Enterprices Factory,, Office Of Ravi Enterprices Factory,",The South 1 K M From P S,Beat4,AKALWADI CHAWL,1,0,0,0,0,0,0,0,0,0,0,0,2022000108,1687,10971168720220070,-1
Hubballi Dharwad City,Ghantikeri PS,0019/2019,1,2019,7,2019-07-06 16:15:00.000,2019-07-06 17:00:00.000,2019-07-06 19:15:00.000,06/07/2019,Heinous,Compounded,Written,THEFT,Cash,15.335732,75.141482,IPC 1860 U/s: 379 ,J.R.NIKKAM   (Dy.SP),1269998,,14820012,"BANKAPUR CHOUCK ASHREYA HOTEL APOSIT, BANKAPUR CHOUCK ASHREYA HOTEL APOSIT",SOUTH 1 KM FROM PS,BEAT 4,BADIGER ONI,1,0,0,0,0,0,0,1,0,1,1,0,2019000060,77,10971007720190019,-1
Hubballi Dharwad City,Kasabapeth PS,0102/2021,1,2021,8,2021-08-30 00:30:00.000,2021-08-30 05:00:00.000,2021-08-30 10:30:00.000,30/08/2021,Non Heinous,Pending Trial,Oral,THEFT,Cash,15.319896,75.137131,IPC 1860 U/s: 379 ,Shashikala   (PSI),1203209,,13900002,"NEAR GABBUR TOLL PLAZA NH-4 BYPASS ROAD, NEAR GABBUR TOLL PLAZA NH-4 BYPASS ROAD",3 km The South form PS,BEAT 29 OLD GABBUR,OLD GABBUR,1,0,0,0,0,0,0,2,0,2,2,0,2021000153,80,10971008020210102,-1
Hubballi Dharwad City,Gokul Road PS,0029/2019,1,2019,4,2019-04-26 10:40:00.000,2019-04-26 10:50:00.000,2019-04-26 16:30:00.000,26/04/2019,Heinous,Undetected,Written,THEFT,Cash,15.351326,75.106202,IPC 1860 U/s: 379 ,NAGARAJ  M KAMMAR (PI),1895538,,117700001,"In between The Oriental Bank Of Commerce and KVG, In between The Oriental Bank Of Commerce and KVG",The West 4 K M From P S,Beat3,Ravi Nagar Left Side,1,0,0,0,0,0,0,0,0,0,0,0,2019000110,71,10971007120190029,-1
Hubballi Dharwad City,Hubballi Sub Urban PS,0172/2023,1,2023,10,2023-10-23 20:00:00.000,2023-10-23 20:45:00.000,2023-10-24 12:00:00.000,24/10/2023,Non Heinous,Pending Trial,Written,THEFT,Cash,15.3579,75.137582,IPC 1860 U/s: 379 ,MALLIKARJUN HOSUR B  (PSI),2976847.0,,7000140,"NEAR KAMAKSHI TEMPLE, DESHPANDE NAGAR, NEAR KAMAKSHI TEMPLE, DESHPANDE NAGAR",NORTH 01KM,BEAT3,New Cotton Market Hubli,1,0,0,0,0,0,0,1,0,1,1,0,2023000300,70,10971007020230172,-1
