District_Name,UnitName,FIRNo,RI,Year,Month,Offence_From_Date,Offence_To_Date,FIR_Reg_DateTime,FIR_Date,FIR Type,FIR_Stage,Complaint_Mode,CrimeGroup_Name,CrimeHead_Name,Latitude,Longitude,ActSection,IOName,KGID,IOAssigned_Date,Internal_IO,Place of Offence,Distance from PS,Beat_Name,Village_Area_Name,Male,Female,Boy,Girl,Age 0,VICTIM COUNT,Accused Count,Arrested Male,Arrested Female,Arrested Count	No.,Accused_ChargeSheeted Count,Conviction Count,FIR_ID,Unit_ID,Crime_No,Cluster_Labels
Gadag,Betageri  PS,0025/2022,1,2022,3,2022-03-05 17:30:00.000,2022-03-05 17:31:00.000,2022-03-08 19:15:00.000,08/03/2022,Non Heinous,Pending Trial,Written,CASES OF HURT,Grievous  Hurt,15.47749,75.653173,"IPC 1860 U/s: 323,326,504,506 ",Noorjan Sabar   (PSI),2373136,,900020,"HIREKOPPA  VILLAGE  INFRANT  OF WITNESS VISHALA, HIREKOPPA  VILLAGE  INFRANT  OF WITNESS VISHALA",NORTH 3 KM FROM  PS,BEAT17,HIREKOPPA,0,1,0,0,0,0,1,1,0,1,1,0,2022000044,1558,10440155820220025,-1
Gadag,Gadag Rural PS,0091/2019,1,2019,4,2019-04-28 22:30:00.000,2019-04-28 22:31:00.000,2019-04-29 10:40:00.000,29/04/2019,Non Heinous,Pending Trial,Written,CASES OF HURT,Grievous  Hurt,15.456139,75.541615,"IPC 1860 U/s: 323,326,504,506,34 ",Mallikarjun Guruputrappa Kulkarni (PSI),2481424,,7100075,"HIREHAMDIGOL VILLAGE NEAR BUS STAND, HIREHAMDIGOL VILLAGE NEAR BUS STAND",12 KM TOWARDS WEST SIDE,BEAT 19,HIREHANDIGOL,1,0,0,0,0,0,3,0,0,0,3,0,2019000190,179,10440017920190091,-1
Gadag,Betageri  PS,0005/2019,1,2019,1,2019-01-16 17:15:00.000,2019-01-16 17:16:00.000,2019-01-17 19:30:00.000,17/01/2019,Non Heinous,Dis/Acq,Others,CASES OF HURT,Grievous  Hurt,15.445984,75.644152,"IPC 1860 U/s: 326,324,323,504,325 ",RAJESH BATAGURKI  (PSI),2135691,,186900048,"AT: BETAGERI AMBABHAVANI CIRCLE, AT: BETAGERI AMBABHAVANI CIRCLE",SOUTH 2 KM FROM PS,BEAT15,OLD B S TEMPLE BOREGAR ONI ASHOK ROAD SHIRHATI ONI POLICE QTRS HEALTH CAMP KADI BANDAR DR VAIDY LANE,1,0,0,0,0,0,1,1,0,1,1,0,2019000005,1558,10440155820190005,-1
Gadag,Shirahatti PS,0011/2023,1,2023,1,2023-01-09 02:30:00.000,2023-01-09 02:31:00.000,2023-01-10 17:00:00.000,10/01/2023,Non Heinous,False Case,Others,CASES OF HURT,Grievous  Hurt,14.955156,75.71996,"IPC 1860 U/s: 341,323,326,109,504,506,34 ",IRAPPA  RITTI (PSI),2841003,,136100102,"Bellatti Laxmeshwar Road, Bellatti Laxmeshwar Road",25kms South From Ps,Shirahatti Beat 27,CHIKKASAVANOOR,1,0,0,0,0,0,1,0,0,0,0,0,2023000013,1562,10440156220230011,-1
Gadag,Ron PS,0223/2022,1,2022,12,2022-12-21 05:30:00.000,2022-12-21 05:31:00.000,2022-12-21 13:15:00.000,21/12/2022,Non Heinous,Pending Trial,Others,CASES OF HURT,Grievous  Hurt,15.701374,75.742403,"IPC 1860 U/s: 506,504,323,325 ",SHIDDAPPA S BILAGI   (PI),1895510.0,,176800129,"In The Complainant House At: Ron Town Shivapete, In The Complainant House At: Ron Town Shivapete",1 Kms's Towards North,NEW BEAT01,RON,0,1,0,0,0,0,1,1,0,1,1,0,2022000315,1564,10440156420220223,-1
Gadag,Lakshmeshwar PS,0018/2021,1,2021,2,2021-02-27 07:00:00.000,2021-02-27 07:01:00.000,2021-02-27 10:30:00.000,27/02/2021,Non Heinous,Dis/Acq,Others,CASES OF HURT,Grievous  Hurt,13.935541,76.479309,"IPC 1860 U/s: 323,326,504,506,34 ",Prakash D PSI   (PSI),1906133.0,,35700013,"AT SUVARNAGIRI TANDA COMPLAINANT HOUSE OPPOSIT, AT SUVARNAGIRI TANDA COMPLAINANT HOUSE OPPOSIT",SOUTH ON 15 KM,BEAT 16,GULAGANJIKOPPA,1,0,0,0,0,0,4,3,1,4,4,0,2021000025,1563,10440156320210018,-1
