District_Name,UnitName,FIRNo,RI,Year,Month,Offence_From_Date,Offence_To_Date,FIR_Reg_DateTime,FIR_Date,FIR Type,FIR_Stage,Complaint_Mode,CrimeGroup_Name,CrimeHead_Name,Latitude,Longitude,ActSection,IOName,KGID,IOAssigned_Date,Internal_IO,Place of Offence,Distance from PS,Beat_Name,Village_Area_Name,Male,Female,Boy,Girl,Age 0,VICTIM COUNT,Accused Count,Arrested Male,Arrested Female,Arrested Count	No.,Accused_ChargeSheeted Count,Conviction Count,FIR_ID,Unit_ID,Crime_No,Cluster_Labels
Haveri,Haveri Town PS,0043/2021,1,2021,5,2021-05-04 09:45:00.000,2021-05-04 09:46:00.000,2021-05-04 10:15:00.000,04/05/2021,Non Heinous,Pending Trial,Sue-moto by Police,PUBLIC SAFETY,Public Safety,14.786788,75.40175,"IPC 1860 U/s: 269 THE KARNATAKA EPIDEMIC DISEASES ACT, 2020 U/s: 5(4) ",N R KATE   (PSI),1203534,,13300018,"In Ambe communication mobile shop near Tara plaza, In Ambe communication mobile shop near Tara plaza",1 Km South side,Town Beat 1,vidya nagar west,0,0,0,0,0,0,1,0,0,0,1,0,2021000057,136,10439013620210043,-1
Haveri,Haveri Rural PS,0062/2021,1,2021,5,2021-05-06 18:45:00.000,2021-05-06 18:46:00.000,2021-05-06 19:30:00.000,06/05/2021,Non Heinous,Pending Trial,Sue-moto by Police,PUBLIC SAFETY,Public Safety,14.848177,75.370971,"IPC 1860 U/s: 269 THE KARNATAKA EPIDEMIC DISEASES ACT, 2020 U/s: 5(4) THE DISASTER MANAGEMENT ACT, 2005 U/s: 51(b) ",SMT NAGAMMA K   (PI),1898728,,35300021,"Near Shibara at Veerabhadreshwar ration shop, Near Shibara at Veerabhadreshwar ration shop",North side 10 km from PS,Beat 6,Devagiri Village,0,0,0,0,0,0,1,0,0,0,1,0,2021000089,137,10439013720210062,-1
Haveri,Halageri PS,0057/2021,1,2021,5,2021-05-04 14:00:00.000,2021-05-04 14:01:00.000,2021-05-04 15:45:00.000,04/05/2021,Non Heinous,Pending Trial,Sue-moto by Police,PUBLIC SAFETY,Public Safety,14.543262,75.535698,"IPC 1860 U/s: 269 THE KARNATAKA EPIDEMIC DISEASES ACT, 2020 U/s: 5(4) ",BHAGYAVATI J BANTI   (PI),1899120,,149700010,"In Accused Groceries & Pancy Store, In Accused Groceries & Pancy Store",09 KM West Side From PS,Beat 4,Hediyal,0,0,0,0,0,0,1,0,0,0,1,0,2021000068,147,10439014720210057,-1
Haveri,Savanoor PS,0103/2021,1,2021,5,2021-05-07 15:00:00.000,2021-05-07 15:01:00.000,2021-05-07 16:15:00.000,07/05/2021,Non Heinous,Pending Trial,Written,PUBLIC SAFETY,Public Safety,14.931935,75.315381,"IPC 1860 U/s: 269 THE KARNATAKA EPIDEMIC DISEASES ACT, 2020 U/s: 5(4),5(1) ",S DEVANAND   (PI),162999,,31900005,"At-Chalyal Village near Bustand, At-Chalyal Village near Bustand",South side 06 K.M.,Beat 31,Mavoor village,0,0,0,0,0,0,1,0,0,0,1,0,2021000122,158,10439015820210103,-1
Haveri,Hirekerur  PS,0078/2021,1,2021,5,2021-05-05 09:00:00.000,2021-05-05 09:01:00.000,2021-05-05 12:00:00.000,05/05/2021,Non Heinous,Dis/Acq,Sue-moto by Police,PUBLIC SAFETY,Public Safety,14.470354,75.464494,"IPC 1860 U/s: 269 THE KARNATAKA EPIDEMIC DISEASES ACT, 2020 U/s: 5,5(4),5(1) ",PATIL R R   (PI),1022307,,117100028,"At:Hireyadachi, At:Hireyadachi",East 15 Km From PS,Beat 4,Shiragambi,0,0,0,0,0,0,2,0,0,0,1,0,2021000095,150,10439015020210078,-1
Haveri,Byadagi PS,0064/2021,1,2021,5,2021-05-03 14:00:00.000,2021-05-03 14:01:00.000,2021-05-03 14:30:00.000,03/05/2021,Non Heinous,Convicted,Sue-moto by Police,PUBLIC SAFETY,Public Safety,14.673878,75.48745,"IPC 1860 U/s: 269 THE KARNATAKA EPIDEMIC DISEASES ACT, 2020 U/s: 5(4) ",BASAVARAJ P.S.   (PI),1966760,,81500046,"Byadagi Main Road, Near APMC  2nd Gate,In Choudri, Byadagi Main Road, Near APMC  2nd Gate,In Choudri",01 KMS West Side from PS.,BEAT 2,SOGERONI,0,0,0,0,0,0,1,0,0,0,1,1,2021000083,140,10439014020210064,-1
Haveri,Haveri Town PS,0045/2021,1,2021,5,2021-05-05 08:45:00.000,2021-05-05 08:46:00.000,2021-05-05 10:30:00.000,05/05/2021,Non Heinous,Dis/Acq,Sue-moto by Police,PUBLIC SAFETY,Public Safety,14.788919,75.403857,"IPC 1860 U/s: 269 THE KARNATAKA EPIDEMIC DISEASES ACT, 2020 U/s: 5(4) ",SURESH  SAGARI (PI),1898671,,15600031,"In M M Basanagoudra Kirani Store at LBS Market, In M M Basanagoudra Kirani Store at LBS Market",East Side 2 km,Town Beat 5,Yalakki Oni,0,0,0,0,0,0,1,0,0,0,1,0,2021000059,136,10439013620210045,-1
Haveri,Hanagal PS,0008/2020,1,2020,1,2020-01-18 14:00:00.000,2020-01-18 14:05:00.000,2020-01-18 20:45:00.000,18/01/2020,Non Heinous,Convicted,Others,PUBLIC SAFETY,Public Safety,14.732104,75.125432,"IPC 1860 U/s: 284,277,337 ",SHREESHAIL PATTANASHETTI  (PSI),2727120,,101300087,"AT:HALEGEJJIHALLI VILLAGE ABUDDIN KALALASAB BALUR, AT:HALEGEJJIHALLI VILLAGE ABUDDIN KALALASAB BALUR",SOUTH SIDE 6 KM FROM PS,Beat 10,Savikeri,0,1,3,1,0,0,2,2,0,2,2,2,2020000012,159,10439015920200008,-1
Haveri,Savanoor PS,0204/2021,1,2021,11,2021-11-15 10:00:00.000,2021-11-15 12:45:00.000,2021-11-15 17:15:00.000,15/11/2021,Non Heinous,Pending Trial,Sue-moto by Police,PUBLIC SAFETY,Public Safety,14.972558,75.339439,"IPC 1860 U/s: 143,290,291,269,341,149 THE KARNATAKA EPIDEMIC DISEASES ACT, 2020 U/s: 5(1)(4) ",S DEVANAND   (PI),162999,,31900005,"Savanur town, Savanur town",South side 1 KM,Beat 01,Savanur Town,0,0,0,0,0,0,29,10,0,10,30,0,2021000249,158,10439015820210204,-1
