District_Name,UnitName,FIRNo,RI,Year,Month,Offence_From_Date,Offence_To_Date,FIR_Reg_DateTime,FIR_Date,FIR Type,FIR_Stage,Complaint_Mode,CrimeGroup_Name,CrimeHead_Name,Latitude,Longitude,ActSection,IOName,KGID,IOAssigned_Date,Internal_IO,Place of Offence,Distance from PS,Beat_Name,Village_Area_Name,Male,Female,Boy,Girl,Age 0,VICTIM COUNT,Accused Count,Arrested Male,Arrested Female,Arrested Count	No.,Accused_ChargeSheeted Count,Conviction Count,FIR_ID,Unit_ID,Crime_No,Cluster_Labels
Bagalkot,Badami PS,0016/2022,1,2022,1,2022-01-26 06:00:00.000,2022-01-26 06:01:00.000,2022-01-26 11:00:00.000,26/01/2022,Non Heinous,Pending Trial,Written,CONSUMER,Essential Commodites Act 1955,15.897437,75.495544,"IPC 1860 U/s: 420,406 ESSENTIAL COMMODITIES ACT, 1955 U/s: 3,7 ",NETRAVATI B PATIL  (WPSI),2481461,,115800057,"VIJAYAPUR HUBBALLI ROAD NEAR ALUR S K CROSS, VIJAYAPUR HUBBALLI ROAD NEAR ALUR S K CROSS",WEST TOWARDS 24 KM,OP BEAT NO 2,KULAGERI,1,0,0,0,0,0,5,4,0,4,5,0,2022000018,1246,10470124620220016,-1
Bagalkot,Amengad PS,0090/2019,1,2019,11,2019-11-17 20:00:00.000,2019-11-17 20:05:00.000,2019-11-17 21:30:00.000,17/11/2019,Non Heinous,Pending Trial,Written,CONSUMER,Essential Commodites Act 1955,16.056706,75.948666,"ESSENTIAL COMMODITIES ACT, 1955 U/s: 3,7 ",Mallikarjun Guruputrappa Kulkarni (PSI),2481424,,7100075,"AMINGAD PATTAN IN MURTUJASAB MASAPATI HOUSE, AMINGAD PATTAN IN MURTUJASAB MASAPATI HOUSE",EAST 1 KM FROM PS,AMINAGAD TOWN BEAT NO 1,AMINAGAD,0,0,0,0,0,0,1,0,0,0,1,0,2019000161,1245,10470124520190090,-1
Bagalkot,Navanagara PS,0017/2022,1,2022,1,2022-01-29 16:29:00.000,2022-01-29 16:30:00.000,2022-01-30 18:30:00.000,30/01/2022,Non Heinous,Pending Trial,Written,CONSUMER,Essential Commodites Act 1955,16.149854,75.675263,"ESSENTIAL COMMODITIES ACT, 1955 U/s: 3,7 ",G.H.KUPPI   (PSI),1332599,,123600010,"APMC Yarda Irappa Annappa Bidari General Mechant, APMC Yarda Irappa Annappa Bidari General Mechant",3 Km Towerds East From PS,06,Navanagar,0,1,0,0,0,0,2,2,0,2,3,0,2022000020,1888,10470188820220017,-1
Bagalkot,Banahatti PS,0048/2021,1,2021,5,2021-05-26 16:10:00.000,2021-05-26 16:11:00.000,2021-05-26 18:45:00.000,26/05/2021,Non Heinous,Pending Trial,Written,CONSUMER,Essential Commodites Act 1955,16.513985,75.164799,"ESSENTIAL COMMODITIES ACT, 1955 U/s: 3(2),7 ",SURESH MANTUR   (PSI),2646912,,31900040,"In Kashimsab Santi Farm Land Shedd, Kulahalli, In Kashimsab Santi Farm Land Shedd, Kulahalli",Towards North 10 km,Rural Beat NO 3,Aski Asangi Village,0,0,0,0,0,0,4,3,0,3,4,0,2021000064,1259,10470125920210048,-1
Bagalkot,Teradal PS,0040/2021,1,2021,7,2021-07-15 11:20:00.000,2021-07-15 11:21:00.000,2021-07-15 14:45:00.000,15/07/2021,Non Heinous,Pending Trial,Written,CONSUMER,Essential Commodites Act 1955,16.473803,75.016603,"ESSENTIAL COMMODITIES ACT, 1955 U/s: 3,7 ",S.K.SURYAVANSHI   (PSI),831631,,125800036,"PATRAS SED IN BAHUBALI JINNAPPA PATIL LAND, PATRAS SED IN BAHUBALI JINNAPPA PATIL LAND",WEST 5 KM FROM PS,TERDAL RURAL BEAT 1,SASALATTI,0,0,0,0,0,0,2,1,0,1,2,0,2021000054,1260,10470126020210040,-1
Bagalkot,Jamakhandi Town PS,0001/2019,1,2019,1,2019-01-01 00:00:00.000,2019-01-04 16:00:00.000,2019-01-04 19:15:00.000,04/01/2019,Non Heinous,Pending Trial,Written,CONSUMER,Essential Commodites Act 1955,16.503462,75.307441,"ESSENTIAL COMMODITIES ACT, 1955 U/s: 3,7 ",G S PATIL   (PSI),2512124,,123300118,"Jamkhandi-Kunchnur Road, Jamkhandi-Kunchnur Road",3 KMs Towards East,BEAT 04,SADANANDA COLONY,0,0,0,0,0,0,2,0,1,1,2,0,2019000001,1250,10470125020190001,-1
Bagalkot,Mahalingapur PS,0012/2024,1,2024,1,2024-01-23 18:14:00.000,2024-01-23 18:15:00.000,2024-01-23 21:15:00.000,23/01/2024,Non Heinous,Under Investigation,Written,CONSUMER,Essential Commodites Act 1955,16.40085,75.10828,"ESSENTIAL COMMODITIES ACT, 1955 U/s: 3,4 ",Praveen Basavaraj Bilagi (PSI),3190520.0,,147800099,"MAHALINGAPUR- RABAKAVI ROAD NEAR GLBC IB, MAHALINGAPUR- RABAKAVI ROAD NEAR GLBC IB",SOUTH 400 MTR AWAY FROM PS,MAHALINGPUR TOWN BEAT 3,DUTCH COLONY,0,0,0,0,0,0,1,0,0,0,0,0,2024000016,1258,10470125820240012,-1
Bagalkot,Navanagara PS,0016/2022,1,2022,1,2022-01-29 15:30:00.000,2022-01-29 15:31:00.000,2022-01-29 22:00:00.000,29/01/2022,Non Heinous,Other Disposal,Written,CONSUMER,Essential Commodites Act 1955,16.149558,75.675449,"ESSENTIAL COMMODITIES ACT, 1955 U/s: 3,7 ",G.H.KUPPI   (PSI),1332599.0,,123600010,"Navanagar APMC Near Irappa Bidari Building, Navanagar APMC Near Irappa Bidari Building",East 3 K M From PS,06,Navanagar,1,0,0,0,0,0,1,2,0,2,2,0,2022000019,1888,10470188820220016,-1
Bagalkot,Bilagi PS,0048/2022,1,2022,3,2022-03-15 15:00:00.000,2022-03-15 15:01:00.000,2022-03-15 18:00:00.000,15/03/2022,Non Heinous,Pending Trial,Written,CONSUMER,Essential Commodites Act 1955,16.349101,75.646291,"ESSENTIAL COMMODITIES ACT, 1955 U/s: 3,7 ",N.S.SIMANI   (PSI),2372873.0,,126300027,"On NH218 Road Near Badagandi Bus Stand, On NH218 Road Near Badagandi Bus Stand",East Side 5 Km From PS,RURAL BEAT 2,BADAGANDI,0,0,0,0,0,0,2,2,0,2,2,0,2022000065,1263,10470126320220048,-1
