District_Name,UnitName,FIRNo,RI,Year,Month,Offence_From_Date,Offence_To_Date,FIR_Reg_DateTime,FIR_Date,FIR Type,FIR_Stage,Complaint_Mode,CrimeGroup_Name,CrimeHead_Name,Latitude,Longitude,ActSection,IOName,KGID,IOAssigned_Date,Internal_IO,Place of Offence,Distance from PS,Beat_Name,Village_Area_Name,Male,Female,Boy,Girl,Age 0,VICTIM COUNT,Accused Count,Arrested Male,Arrested Female,Arrested Count	No.,Accused_ChargeSheeted Count,Conviction Count,FIR_ID,Unit_ID,Crime_No,Cluster_Labels
Bengaluru City,Adugodi PS,0115/2022,1,2022,6,2022-06-04 12:30:00.000,2022-06-04 14:00:00.000,2022-06-04 14:00:00.000,04/06/2022,Non Heinous,Convicted,Sue-moto by Police,NEGLIGENT ACT,Explosive/Explosive Substances - Related,12.942769,77.609117,"LIQUIFIED PETROLEUM GAS SUPPLY & CONTROL ORDER 2000 U/s: 3(1)(a)(b)(c) Liquified Petroleum Gas (Regulation of Supply & Distribution) Order 2000 U/s: 3(2) LIQUIFIED PETROLEUM GAS SUPPLY & CONTROL ORDER 2000 U/s: 3,4 Liquified Petroleum Gas (Regulation of Supply & Distribution) Order 2000 U/s: 4(1)(a),4(1) (b),4(1)(c),4(1)(d),7(1)(a) LIQUIFIED PETROLEUM GAS SUPPLY & CONTROL ORDER 2000 U/s: 7(c) Liquified Petroleum Gas (Regulation of Supply & Distribution) Order 2000 U/s: 7(1)(b) LIQUIFIED PETROLEUM GAS SUPPLY & CONTROL ORDER 2000 U/s: 7(1)(c) IPC 1860 U/s: 285 ",NAGARAJ SANGAPPA SHETTAR (PSI),2925383.0,,138000168,"MCS cycle shop, No-40,3rd cross, MCS cycle shop, No-40,3rd cross",From ps towards North 2km,BEAT 4,BAZAR STREET,0,0,0,0,0,0,1,0,0,0,1,1,2022000171,1382,10443138220220115,-1
Bengaluru City,Parappana Agrahara PS,0055/2024,1,2024,1,2024-01-25 15:00:00.000,2024-01-25 16:30:00.000,2024-01-25 18:05:00.000,25/01/2024,Non Heinous,Under Investigation,Written,NEGLIGENT ACT,Explosive/Explosive Substances - Related,12.849064,77.64812,IPC 1860 U/s: 285 ,Sachin H R   (PSI),3230238,,180000126,"5th Cross , In Front Off Gajanand House, 5th Cross , In Front Off Gajanand House",Towards 3 km from ps,BEAT NO 7,CHIKKANAGAMANGALA,0,0,0,0,0,0,1,0,0,0,1,0,2024000063,1800,10443180020240055,-1
Bengaluru City,Kodigehalli PS,0351/2023,1,2023,11,2023-11-13 22:30:00.000,2023-11-13 23:00:00.000,2023-11-13 23:00:00.000,13/11/2023,Non Heinous,Pending Trial,Written,NEGLIGENT ACT,Explosive/Explosive Substances - Related,13.058675,77.582894,IPC 1860 U/s: 285 ,KOUSHIK N V   (PSI),3174019,,303380,"NO-192 HOUSE OPPOSITE, 1 ST STAGE, 2 ND MAIN,, NO-192 HOUSE OPPOSITE, 1 ST STAGE, 2 ND MAIN,",TOWARDS WEST 1.5 K,BEAT 1,Thindlu,0,0,0,0,0,0,1,1,0,1,1,0,2023000441,1873,10443187320230351,-1
Bengaluru City,Suddaguntepalya PS,0023/2024,1,2024,1,2023-12-23 17:30:00.000,2024-01-23 19:30:00.000,2024-01-23 20:00:00.000,23/01/2024,Non Heinous,Under Investigation,Sue-moto by Police,NEGLIGENT ACT,Explosive/Explosive Substances - Related,12.920329,77.602554,"IPC 1860 U/s: 285 LIQUIFIED PETROLEUM GAS SUPPLY & CONTROL ORDER 2000 U/s: 4(1)(A),4(1)(d),4(1)(c),7(1)(b),7(1)(a),3(4),7(1)(c),3(1)(a)(b)(c) ",Shrikant Naykar   (PSI),2845361,,182200088,"Salim gas stow Repairi,7th Main road, Salim gas stow Repairi,7th Main road",Towards 1 km Southwest,1st Beat,Ninth A main,0,0,0,0,0,0,1,0,0,0,0,0,2024000025,2197,10443219720240023,-1
Bengaluru City,Yelahanka New Town PS,0511/2023,1,2023,11,2023-11-13 22:40:00.000,2023-11-13 22:45:00.000,2023-11-13 22:50:00.000,13/11/2023,Non Heinous,Pending Trial,Written,NEGLIGENT ACT,Explosive/Explosive Substances - Related,13.093148,77.582653,IPC 1860 U/s: 285 ,Sushma M L   (WPSI),3050641.0,,135600028,"Opposite Kathi Sweets, Chikkabommasandra, Opposite Kathi Sweets, Chikkabommasandra",500 Mts From P S,2  Beat,CHIKKABOMMASANDRA,0,0,0,0,0,0,1,1,0,1,1,0,2023000640,1356,10443135620230511,-1
