District_Name,UnitName,FIRNo,RI,Year,Month,Offence_From_Date,Offence_To_Date,FIR_Reg_DateTime,FIR_Date,FIR Type,FIR_Stage,Complaint_Mode,CrimeGroup_Name,CrimeHead_Name,Latitude,Longitude,ActSection,IOName,KGID,IOAssigned_Date,Internal_IO,Place of Offence,Distance from PS,Beat_Name,Village_Area_Name,Male,Female,Boy,Girl,Age 0,VICTIM COUNT,Accused Count,Arrested Male,Arrested Female,Arrested Count	No.,Accused_ChargeSheeted Count,Conviction Count,FIR_ID,Unit_ID,Crime_No,Cluster_Labels
Davanagere,Harihara Rural PS,0077/2023,1,2023,4,2023-04-16 22:30:00.000,2023-04-17 05:30:00.000,2023-04-17 12:10:00.000,17/04/2023,Non Heinous,Pending Trial,Written,BURGLARY - NIGHT,Temple Theft,14.537857,75.815196,"IPC 1860 U/s: 457,380 ",ABDUL KHADER JILANI   (PSI),3241228,,152100064,"Chandragutyamma Temple, Rajanhalli Village, Chandragutyamma Temple, Rajanhalli Village",Towards South 12 km,13,RAJANAHALLI,1,0,0,0,0,0,2,2,0,2,2,0,2023000106,111,10438011120230077,-1
Davanagere,RMC Yard PS,0097/2023,1,2023,11,2023-11-11 22:00:00.000,2023-11-12 06:00:00.000,2023-11-12 13:30:00.000,12/11/2023,Non Heinous,Pending Trial,Others,BURGLARY - NIGHT,Temple Theft,14.471628,75.947185,"IPC 1860 U/s: 457,380 ",SACHIN BIRADAR   (PSI),3122782,,192500017,"Sri Choudeswari Temple Ele Bethuru Road, Sri Choudeswari Temple Ele Bethuru Road",Towerds North 01.00 km To PS,1st BEAT,ANEKONDA,1,0,0,0,0,0,0,2,0,2,2,0,2023000138,1519,10438151920230097,-1
Davanagere,Channagiri PS,0055/2021,1,2021,2,2021-02-18 18:30:00.000,2021-02-19 05:50:00.000,2021-02-20 11:00:00.000,20/02/2021,Non Heinous,Pending Trial,Written,BURGLARY - NIGHT,Temple Theft,13.865389,75.98156,"IPC 1860 U/s: 380,457,427 ",Madhu P B   (PI),2153851,,120000034,"Masanikere Village In Padamagiri Temple, Masanikere Village In Padamagiri Temple",South 22 Km From Channagiri PS,tvkbeat 2,KALKERE,1,0,0,0,0,0,2,0,0,0,2,0,2021000064,1522,10438152220210055,-1
Davanagere,Gandhi Nagar PS,0074/2021,1,2021,10,2021-10-10 23:30:00.000,2021-10-11 06:00:00.000,2021-10-11 11:00:00.000,11/10/2021,Non Heinous,Pending Trial,Others,BURGLARY - NIGHT,Temple Theft,14.48396,75.917208,"IPC 1860 U/s: 457,380 ",PREMILAMMA.H   (PSI),1329790,,10100056,"Ganeshs Temple budal road sps nagara, Ganeshs Temple budal road sps nagara",2KM WEST,BEAT 2,sps nagara first stage,1,0,0,0,0,0,2,2,0,2,2,0,2021000103,99,10438009920210074,-1
Davanagere,Channagiri PS,0400/2023,1,2023,9,2023-09-18 00:15:00.000,2023-09-18 00:30:00.000,2023-09-18 16:00:00.000,18/09/2023,Non Heinous,Under Investigation,Others,BURGLARY - NIGHT,Temple Theft,14.085386,75.876983,"IPC 1860 U/s: 457,380 ",E.KAVITHA   (PSI),1457897,,99700038,"Shree Padmagiri Chowdheshwari Temple, Shree Padmagiri Chowdheshwari Temple",20 KM Towards South To Ps,tvkbeat 2,KALKERE,1,0,0,0,0,0,1,0,0,0,0,0,2023000490,1522,10438152220230400,-1
