District_Name,UnitName,FIRNo,RI,Year,Month,Offence_From_Date,Offence_To_Date,FIR_Reg_DateTime,FIR_Date,FIR Type,FIR_Stage,Complaint_Mode,CrimeGroup_Name,CrimeHead_Name,Latitude,Longitude,ActSection,IOName,KGID,IOAssigned_Date,Internal_IO,Place of Offence,Distance from PS,Beat_Name,Village_Area_Name,Male,Female,Boy,Girl,Age 0,VICTIM COUNT,Accused Count,Arrested Male,Arrested Female,Arrested Count	No.,Accused_ChargeSheeted Count,Conviction Count,FIR_ID,Unit_ID,Crime_No,Cluster_Labels
Haveri,Kaginele PS,0103/2022,1,2022,12,2022-12-10 10:30:00.000,2022-12-10 18:00:00.000,2022-12-12 20:15:00.000,12/12/2022,Non Heinous,False Case,Written,KIDNAPPING AND ABDUCTION,Missing-Girl,14.653517,75.357811,IPC 1860 U/s: 363 ,S P HOSAMANI   (PSI),1202510,,13700035,"AT-KUMMUR COMPLAINENT HOUSE, AT-KUMMUR COMPLAINENT HOUSE",08 KM SOUTH,BEAT 4,Hirehalli,0,0,0,1,0,0,0,0,0,0,0,0,2022000166,141,10439014120220103,-1
Haveri,Haveri Women PS,0029/2022,1,2022,4,2022-04-10 12:30:00.000,2022-04-10 17:30:00.000,2022-04-12 14:15:00.000,12/04/2022,Non Heinous,False Case,Oral,KIDNAPPING AND ABDUCTION,Missing-Girl,14.73018,75.426945,IPC 1860 U/s: 363 ,M C Ganager   (ASI),1202977,,13700003,"At Homberady Villege Frome Complainent Home, At Homberady Villege Frome Complainent Home",Towards East Side 08 KM PS,Haveri Rural Police Station,kaginelle,0,0,0,1,0,0,0,0,0,0,0,0,2022000029,2143,10439214320220029,-1
Haveri,Haveri Women PS,0049/2019,1,2019,10,2019-10-08 20:00:00.000,2019-10-08 20:01:00.000,2019-10-09 12:45:00.000,09/10/2019,Non Heinous,False Case,Others,KIDNAPPING AND ABDUCTION,Missing-Girl,14.717097,75.331768,IPC 1860 U/s: 363 ,SULOCHANA HONNAPPA GARAG (PSI),1202893,,13600040,"At:Kabbur Tanda From Complaint House, At:Kabbur Tanda From Complaint House",West side 13 kms from PS,Haveri Rural Police Station,kaginelle,0,0,0,1,0,0,0,0,0,0,0,0,2019000049,2143,10439214320190049,-1
Haveri,Ranebennur Rural PS,0229/2023,1,2023,10,2023-10-16 06:00:00.000,2023-10-16 06:05:00.000,2023-10-16 10:30:00.000,16/10/2023,Non Heinous,Under Investigation,Written,KIDNAPPING AND ABDUCTION,Missing-Girl,14.623801,75.621788,IPC 1860 U/s: 363 ,Praveenkumar V   (PI),2393759,,72200113,"AT-Ranebennur Halageri road SRK Nagara Copmlenent, AT-Ranebennur Halageri road SRK Nagara Copmlenent",SOUTH SIDE 04 KM FROM PS,Ranebennur Rural PS,Ranebennur Rural PS,0,0,0,1,0,0,0,0,0,0,0,0,2023000289,146,10439014620230229,-1
Haveri,Haveri Women PS,0019/2022,1,2022,3,2022-02-28 08:45:00.000,2022-02-28 16:30:00.000,2022-03-01 14:45:00.000,01/03/2022,Non Heinous,False Case,Others,KIDNAPPING AND ABDUCTION,Missing-Girl,14.79386,75.396263,IPC 1860 U/s: 363 ,SULOCHANA HONNAPPA GARAG (PSI),1202893,,13600040,"From J P Rotari High School, Haveri, From J P Rotari High School, Haveri",03 k m from p s towords north side.,Haveri Beat no 3,Ijarilakamapur,0,0,0,1,0,0,0,0,0,0,0,0,2022000019,2143,10439214320220019,-1
Haveri,Savanoor PS,0051/2019,1,2019,4,2019-04-08 04:30:00.000,2019-04-08 05:30:00.000,2019-04-10 16:30:00.000,10/04/2019,Non Heinous,False Case,Written,KIDNAPPING AND ABDUCTION,Missing-Girl,14.944841,75.424981,IPC 1860 U/s: 363 ,Annapurna M Hulagur   (WPSI),222999.0,,13600071,"From Hattimattur village Complainant mother house, From Hattimattur village Complainant mother house",Towards Easten 12 km from PS,Beat 36,Kalalakonda village,0,0,0,1,0,0,0,0,0,0,0,0,2019000134,158,10439015820190051,-1
